{
  "stage_id": "2.2",
  "layer_module_ref": "Security Domains",
  "run_id": "run-20260731_145000",
  "project_id": "cleverdent",
  "evaluated_at": "2026-07-31T14:50:00Z",
  "summary": {
    "total_checks": 3,
    "passed": 2,
    "failed": 1,
    "warnings": 0
  },
  "results": [
    {
      "item_id": "secrets_management",
      "status": "FAIL",
      "component_id": "dent-api-nestjs",
      "title": "Secrets Management — hardcoded credentials",
      "rule_id": "ASRP-SEC-001",
      "review_checklist_ref": "CHK-AUTH-004",
      "evidence": {
        "file_path": "apps/dent-login/src/config/clients/client-credentials.ts",
        "start_line": 8,
        "code_snippet": "client_secret: 'w564rRzEjS3EjPMKAYKpXRoFqa+CEObJy79aCK6SlUQig3uZhoii3A==',",
        "message": "Hardcoded OIDC client secret in source — same vuln as ASVS V2.10.3, different domain lens"
      },
      "standard_mappings": {
        "cwe": ["CWE-798"],
        "owasp_top10_2021": ["A07:2021-Identification and Authentication Failures"],
        "asvs_v4": ["V2.10.3"]
      },
      "remediation": {
        "summary": "Move client secrets to environment variables or secrets manager",
        "patch_ref": "REM-SEC-001"
      }
    },
    {
      "item_id": "authentication",
      "status": "PASS",
      "component_id": "dent-api-nestjs",
      "title": "Authentication domain — OIDC flow configured"
    },
    {
      "item_id": "input_validation",
      "status": "PASS",
      "component_id": "dent-api-nestjs",
      "title": "Input validation domain — class-validator in use"
    }
  ]
}
